{
  "registry_version": "1.0.0",
  "as_of": "2026-08-20",
  "scope": "Primary-source evidence for communication-efficiency methods plausibly relevant to compact or induced agent formats, topology and routing pruning, latent channels, end-to-end agent tasks, and the systems transport boundary. Headline values remain in their original ledgers and are not a global ranking.",
  "project_claims": {
    "sota_claim_made": false,
    "world_record_claim_made": false,
    "paid_model_calls_used": false
  },
  "comparability_lanes": [
    {
      "id": "generated_message_tokens",
      "definition": "Decoded tokens generated as inter-agent messages or response payloads, measured with the paper's tokenizer or provider counter.",
      "unit": "tokens",
      "included": ["decoded inter-agent message text"],
      "excluded": ["input prompts", "system prompts", "task input", "format induction", "training", "wire framing", "retries unless the source explicitly includes them"]
    },
    {
      "id": "provider_prompt_tokens",
      "definition": "Provider-reported or tokenizer-counted input tokens over agent API calls in an evaluated trajectory.",
      "unit": "tokens",
      "included": ["agent input prompts and accumulated upstream messages when counted by the source"],
      "excluded": ["completion tokens", "wire bytes", "training calls unless explicitly stated", "non-model orchestration"]
    },
    {
      "id": "provider_completion_tokens",
      "definition": "Provider-reported or tokenizer-counted output tokens over agent API calls in an evaluated trajectory.",
      "unit": "tokens",
      "included": ["agent completions"],
      "excluded": ["prompt tokens", "wire bytes", "training calls unless explicitly stated"]
    },
    {
      "id": "total_runtime_model_tokens",
      "definition": "Prompt plus completion tokens consumed by all runtime model calls named by the source.",
      "unit": "tokens",
      "included": ["runtime prompt tokens", "runtime completion tokens", "supervisor overhead when the source reports net totals"],
      "excluded": ["training or induction unless explicitly amortized", "wire bytes", "tool compute", "wall-clock time"]
    },
    {
      "id": "system_decoded_output_tokens",
      "definition": "Total decoded output tokens across a multi-agent inference run; latent steps and transferred tensors are not tokens in this ledger.",
      "unit": "tokens",
      "included": ["decoded outputs from all agents as defined by the source"],
      "excluded": ["input tokens", "latent steps", "KV-cache bytes", "training", "hardware transfer cost"]
    },
    {
      "id": "tokenizer_count_short_message",
      "definition": "Static tokenizer count for semantically matched short surface-form examples.",
      "unit": "tokens",
      "included": ["serialized message surface"],
      "excluded": ["receiver task success", "teaching prompts", "retries", "full envelope", "cold start"]
    },
    {
      "id": "message_generation_latency",
      "definition": "Wall-clock latency of producing an inter-agent message or latent message, not the complete downstream task trajectory.",
      "unit": "seconds",
      "included": ["sender-side message generation path defined by the source"],
      "excluded": ["full task execution", "environment actions", "training"]
    },
    {
      "id": "end_to_end_inference_latency",
      "definition": "Wall-clock time for the paper's complete multi-agent inference pipeline on one run.",
      "unit": "seconds per run",
      "included": ["paper-defined end-to-end model inference"],
      "excluded": ["training", "data preparation", "hardware acquisition", "cost outside the measured run"]
    },
    {
      "id": "ttft_prefill_latency",
      "definition": "Time to first token or prefill latency for a serving request under a specified cache-sharing workload.",
      "unit": "milliseconds",
      "included": ["prefill and first-token boundary as corrected in the source"],
      "excluded": ["remaining decode", "complete task latency", "training", "network transport unless stated"]
    },
    {
      "id": "workflow_end_to_end_latency",
      "definition": "Wall-clock latency for a complete synthetic or application workflow at the serving-system layer.",
      "unit": "seconds or normalized speedup",
      "included": ["all model invocations in the specified workflow", "cache movement handled by the serving system"],
      "excluded": ["task-quality changes when output equivalence is guaranteed by unchanged computation", "training"]
    },
    {
      "id": "monetary_inference_cost",
      "definition": "Provider-priced inference cost for the model calls in a named task workflow; this lane can change when models or prices change even if token counts do not.",
      "unit": "USD per task",
      "included": ["provider-reported input and output usage multiplied by the source's stated prices"],
      "excluded": ["training and search unless stated", "non-model compute", "wire bytes", "cost under later provider prices"]
    },
    {
      "id": "latent_payload_bytes",
      "definition": "Logical or measured byte footprint of a latent or KV payload exchanged between model stages under the source's precision and serialization assumptions.",
      "unit": "bytes or megabytes",
      "included": ["paper- or repository-defined latent payload storage or transfer volume"],
      "excluded": ["sender and receiver compute", "metadata and network framing unless measured", "task latency", "training"]
    },
    {
      "id": "accuracy_cost_frontier_only",
      "definition": "A source reports a cost-quality curve or qualitative cost objective but no auditable scalar token-reduction headline.",
      "unit": "descriptive",
      "included": ["reported frontier points"],
      "excluded": ["inferred percentage reductions not printed or recoverable from a table"]
    }
  ],
  "records": [
    {
      "id": "autoform_2024",
      "method": "AutoForm",
      "track": "compact_symbolic_or_induced",
      "comparison_class": "same_workload_candidate",
      "publication": {
        "title": "AutoForm: Efficient and Effective Agent Communication with Automatic Information Formatting",
        "venue": "Findings of EMNLP 2024",
        "status": "peer_reviewed_findings",
        "date": "2024-11",
        "primary_url": "https://aclanthology.org/2024.findings-emnlp.623/",
        "doi_or_id": "10.18653/v1/2024.findings-emnlp.623"
      },
      "headline": {
        "claim": "72.7% fewer generated communication tokens on HotpotQA for a GPT-4 initiator and GPT-3.5 recipient.",
        "metric": "mean generated communication tokens per task",
        "value": 72.7,
        "unit": "percent reduction",
        "direction": "lower_is_better",
        "baseline": "natural-language communication, 345.5 tokens; AutoForm, 94.3 tokens",
        "comparability_lane": "generated_message_tokens",
        "incomparable_reason": null
      },
      "workload": {
        "tasks": ["HotpotQA", "WikiHop", "NarrativeQA"],
        "sample_definition": "100 examples per dataset in the released experiment configuration; the repository data digests are recorded in the report.",
        "topology": "Two agents: an initiator sends a formatted message to a recipient that produces the task answer.",
        "repetitions": "One reported aggregate per model pairing; no seed-based confidence interval reported.",
        "hardware": "Closed-provider inference; hardware not reported."
      },
      "models": ["gpt-4-1106-preview", "gpt-3.5-turbo-1106", "GPT-4/GPT-4 and GPT-3.5/GPT-3.5 pairings also reported"],
      "ledger": {
        "included": ["generated communication-message tokens"],
        "excluded": ["system and user prompts", "task documents", "recipient answer tokens", "format-selection prompt cost", "full wire envelope", "retries", "cold start"],
        "unknown": ["exact tokenizer/counting implementation", "whether every formatting control token is included"]
      },
      "success_constraint": {
        "metric": "Paper labels the main score F1 in prose but table captions use Rouge-L; this ambiguity must be preserved.",
        "baseline": "0.64 on HotpotQA",
        "method": "0.70 on HotpotQA",
        "constraint": "Reported task score is non-decreasing on the headline cell.",
        "satisfied_as_reported": true
      },
      "artifacts": {
        "code": {
          "availability": "complete",
          "url": "https://github.com/thunlp/AutoForm",
          "revision": "8df94501c462e7f7b4708e5f0297fbdcf8e12ffa",
          "license": "Apache-2.0",
          "license_status": "verified",
          "notes": "Official repository includes prompts, task runners, and experiment data/configuration."
        },
        "data": {
          "availability": "complete",
          "url": "https://github.com/thunlp/AutoForm",
          "revision": "8df94501c462e7f7b4708e5f0297fbdcf8e12ffa",
          "license": null,
          "license_status": "upstream_mixed_or_unmanifested",
          "notes": "Released task artifacts are pinned by repository revision; upstream dataset licenses are not consolidated in a source manifest."
        }
      },
      "reproduction": {
        "literal": "no",
        "clean_room": "yes",
        "literal_blockers": ["The exact 2023 closed model snapshots are retired or non-stable provider endpoints.", "The score-label inconsistency and token-counter boundary prevent a unique literal reconstruction."],
        "clean_room_requirements": ["Use the released 100-item task artifacts and prompts.", "Pin replacement models and tokenizers.", "Report generated-message, full-runtime-token, full-envelope-byte, and cold-start ledgers separately."]
      },
      "sources": [
        {"kind": "official_proceedings", "url": "https://aclanthology.org/2024.findings-emnlp.623/", "checked_on": "2026-08-20", "link_status": "retrieved"},